Product,Category,UserRating,Tags2,UserInput
DERMAdoctor Wrinkle Revenge Antioxidant Enhanced Glycolic Acid Facial Cleanser 2,More Cleanser,9.0,derma cleanser result product price dermadoctor,0
DERMAdoctor Wrinkle Revenge Antioxidant Enhanced Glycolic Acid Facial Cleanser 3,More Cleanser,6.0,wrinkle revenge product gradually difference cleanser,0
DERMAdoctor Wrinkle Revenge Rescue & Protect Facial Cream,More Anti-Aging,6.5,sticky cream product super still something,0
DHC Acerola 100,More Moisturizer,8.5,outbreaks clear actually acerola within whole,0
DHC Acerola Gel,More Moisturizer,8.0,without product moisturizer moisturize leave would,0
DHC Acne Spot Therapy,More Blemish + Acne Control,9.0,product years towel terrible stain smell,0
DHC Alpha-Arbutin White Cream,More Moisturizer,8.0,really semester relly product havent difference,0
DHC Antiox C,More Moisturizer,7.0,provide moisture vitamin really little great,0
DHC Beauty Lift Eye Care Essence Roll On,More Eye Treatments,6.0,really serum result without weeks wasnt,0
DHC Ceramide Cream,More Moisturizer,10.0,regimen website usually thing stress sensitive,0
DHC Cleansing Foam,More Cleanser,9.5,leave clean winter tight thoroughly pleasant light,0
DHC Deep Cleansing Oil,More Cleanser,10.0,makeup product cleanse clean remove leave,0
DHC Emollient Balm,More Moisturizer,7.0,light facial water wasnt thrill thick,0
DHC Extra Nighttime Moisture,More Night Cream,8.5,cream moisturizer extra replace prone night,0
DHC Eye Bright,More Eye Treatments,7.0,circle product really makeup smooth puffy,0
DHC Eye Treatment Essence Peptides,More Eye Treatments,1.0,water toner splash nothing might,0
DHC Eye Wrinkle Stick,More Eye Treatments,8.0,stick around wrinkle soothe smooth small,0
DHC Germanium Cream,More Moisturizer,7.0,quickly absorb within unfortunately unclear stand,0
DHC Neck Treatment Essence Peptides,More Anti-Aging,1.0,youthful wrinkle supple slight search quite,0
DHC Olive Virgin Oil,More Moisturizer,9.0,olive product bottle night moisturizer little,0
DHC Platinum Silver Nanocolloid Milky Essence,More Anti-Aging,4.5,would sample research product moisturize without,0
DHC Q10 Eye Cream,More Eye Treatments,9.0,cream absorb wrinkle suppleness smoother skin product,0
DHC Q10 Facial Film Soap,More Cleanser,10.0,lather cleanser product water still recommend,0
DHC Q10 Milk,More Moisturizer,10.0,years thicker several sample result product,0
DHC Q10 Neck Cream,More Anti-Aging,9.0,travel supple smooth sample retain product,0
DHC Q10 Water Mist,"More Toners, Astringents",9.0,refresh would sometimes something price night,0
DHC Retino A Essence,More Anti-Aging,10.0,weeks spend nothing dollars brand actually,0
DHC Revitalizing Moisture Strips: Eyes,More Eye Treatments,9.0,strip relax product little circle revitalize,0
DHC Rich Moisture,More Moisturizer,9.0,three cream without underneath texture sunscreen,0
DHC Rose Water,"More Toners, Astringents",9.5,toners summer spritz spray soothe love smell,0
DHC Soft Touch Cleansing Oil,More Cleanser,9.0,smooth shower paste microfoliant leave exfoliate,0
DHC Washing Powder,More Cleanser,9.0,powder leave water without strip remove,0
DHC Wrinkle Filler,More Anti-Aging,10.0,refuse products whatever upper today thing,0
DML Facial Moisturizer SPF 25,More Moisturizer,9.0,smooth wrinkle visably sample protection get powder,0
DML Moisturizing Lotion,More Moisturizer,8.0,moisturizer lotion would think thick result,0
DNA Damage Control Active Broad Spectrum SPF 43,More Sun Protection,10.0,worth worst water velvety think sunscreens,0
DNA EGF Renewal DNA Defense SPF 30+,More Moisturizer,9.0,sensitive great facial definitely worth whats,0
DNA EGF Renewal DNA Eye Renewal,More Eye Treatments,10.0,younger weeks thank result renewal happy renewal,0
DNA EGF Renewal DNA Intensive Renewal,More Anti-Aging,10.0,weeks renewal product intensive wonderful supple,0
DNA EGF Renewal DNA Night Renewal,More Anti-Aging,10.0,renewal night favorite worry without transform,0
DNA EGF Renewal Growth Factor Serum,More Anti-Aging,10.0,bacteria theres serum plant whole think,0
DS Laboratories Hydroviton CR Liquid Normalizing Soap,More Cleanser,9.0,without throw thoroughly stuff really prone,0
DS Laboratories Viterol.A Cream for Wrinkles and Expression Lines,More Eye Treatments,2.0,product didnt younger wrinkle would women,0
Dairyface Eye Caramba Nourishing Facial Refresher,More Moisturizer,10.0,product dairy stain smooth smell shower,0
Darphin 8-Flower Nectar Oil Cream,More Anti-Aging,9.0,would think scent cream transformative smite,0
Darphin Aromatic Purifying Balm,More Night Cream,9.0,purify perfect monthly extra clean breakouts,0
Darphin Aromatic Renewing Balm,More Moisturizer,4.0,little smell severe product petroleum jelly,0
Darphin Arovita C Energic Firming Cream,More Anti-Aging,9.0,really greasy cream would thing surprise,0
Darphin Arovita C Line Response Cream,More Anti-Aging,8.5,product apply years several quickly never,0
Darphin Arovita C Line Response Firming Serum,More Anti-Aging,5.0,smell perfume scent wonderful wonder uneasy,0
Darphin Arovita Eye and Lip Contour Gel,More Eye Treatments,9.0,cream wonderful treat standard spend spatula,0
Darphin Dark Circles Relief and De-Puffing Eye Serum,More Eye Treatments,9.5,result worth easy treat totally steep product,0
Darphin Hydraskin Rich,More Moisturizer,10.0,really winter weeks start right result,0
Darphin Intral Balm,More Moisturizer,10.0,night great cuticles anymore never,0
Darphin Intral Cleansing Milk,More Cleanser,9.0,smell sensitive product would without among whenever,0
Darphin Intral Toner,"More Toners, Astringents",8.5,sensitive reduce redness really really product perfect,0
Darphin Intralderm Soothing Gel,More Moisturizer,7.0,purify combine combination,0
Darphin Jasmine Aromatic Care,More Anti-Aging,10.0,jasmine smooth young talk love softer smoother,0
Darphin Lifting and Firming Eye Serum,More Eye Treatments,10.0,serum tighten start smoothly mild serums sensitive,0
Darphin Niaouli Aromatic Care,More Anti-Aging,10.0,product worth pricey combination break whirl,0
Darphin Predermine Replenishing Anti-Wrinkle Cream,More Anti-Aging,8.0,product light wrinkle thick still scent,0
Darphin Predermine Wrinkle Corrective Serum,More Anti-Aging,10.0,great wrinkle skin start serum sensitive predermine,0
Darphin Purifying Toner,"More Toners, Astringents",9.0,waste toners toner thats sting right,0
Darphin Refreshing Toner,"More Toners, Astringents",7.0,worth smell sample refresh ready product,0
Darphin Soleil Plaisir,More Sun Protection,9.0,smell really white vacation sunscreens sunscreen,0
Darphin Stimulskin Plus Firming Smoothing Cream - Dry Skin,More Anti-Aging,10.0,product never expensive years worth thick,0
Darphin Stimulskin Plus Intensive Face Lifting Complex,More Anti-Aging,9.0,wonder without totally products parabens natural,0
Darphin Stimulskin Plus Rejuvenating Lifting Serum,More Anti-Aging,5.0,product instantly highly whatsoever velvety ultra,0
Darphin Tangerine Aromatic Care,More Anti-Aging,9.5,smooth smell price little leave worth smell,0
Davi Skincare Crushed Grape Seed Exfoliating Cleanser,More Cleanser,9.0,texture shampoo harsh hand take clear clean,0
Decleor Alpha Hydrating Cream SPF 12,More Sun Protection,6.0,product would worth sephora sample receive,0
Decleor Aroma Purete - Instant Purifying Mask,More Blemish + Acne Control,9.0,really patch occasional improvement immediately glow like,0
Decleor Aroma Sun Anti Wrinkle Cream SPF 15,More Sun Protection,7.0,touch probably great winter smooth regular,0
Decleor Aromessenc Iris - TimeCare Concentrate,More Anti-Aging,8.0,wonderful soothe smell recommend highly great,0
Decleor Aromessence Baume Essentiel - Essential Balm,More Moisturizer,10.0,product decleor breakouts years would smooth,0
Decleor Aromessence Baume Levres - Lip Balm,More Moisturizer,7.0,smell small reapply purse others natural,0
Decleor Aromessence Baume de Nuit,More Blemish + Acne Control,10.0,smooth little wonderful thick instantly ylangylang,0
Decleor Aurabsolu Intense Glow Awakening Cream,More Moisturizer,7.0,unpleasant thats texture supple somewhat smell,0
Decleor Aurabsolu Intense Glow For Eyes,More Eye Treatments,7.0,applicator wrinkle though think thick sweet,0
Decleor Brume Fraiche Hydratante - Fresh Hydrating Mist for Face by Decleor,More Moisturizer,10.0,value recharge money minerals ideal humid,0
Decleor Experience De L'age - Triple Action Light Cream,More Anti-Aging,10.0,leave hydrate extremely beautifully absorb,0
Decleor Gel Demaquillante - Cleansing Gel for Face,More Cleanser,8.0,gentle cleanser start really products product,0
Decleor Harmonie - Gentle Soothing Cream for Face,More Moisturizer,10.0,soothe sensitive cream really products leave,0
Decleor Hydra Floral Moisturising Gel-Cream for Eyes,More Eye Treatments,8.0,great would really problem moisturize easily,0
Decleor Hydra Floral Moisturizing Cream,More Moisturizer,9.0,ylang really moisturizer great someone smell,0
Decleor Hydrotenseur Eye Contour Firming Serum,More Anti-Aging,8.0,serum lotion result product hydrotenseur firning,0
Decleor Instant Radiance Moisturizer,More Moisturizer,9.0,extract wheat surprise silicone radiance protein,0
Decleor Lotion Matifiante - Matifying Lotion - Visage Face,More Cleanser,10.0,great decleor toner matte control cleanser,0
Decleor Lotion Tonifiante - Tonifying Lotion for Face,"More Toners, Astringents",9.0,little leave tight thoroughly strip residue,0
Defy Age Erasing Serum,More Anti-Aging,7.0,smell silky sample product fresh,0
Derma E Antioxidant Natural Sunscreen SPF 30 Oil-Free Face Lotion,More Sun Protection,7.0,thick sunscreen smoothly pretty moisturizer makeup,0
Derma E Glycolic Facial Cleanser with Marine Plant Extracts,More Cleanser,10.0,product glycolic cleanser vitamin thank surface,0
Derma E Vitamin C Renewing Moisturizer,More Moisturizer,7.0,strong lightweight light didnt would vitamin,0
DermaBlend Creme Corrective,More Anti-Aging,9.5,product cover little foundation amaze years,0
DermaDoctor Wrinkle Revenge Rescue & Protect Eye Balm,More Eye Treatments,9.5,product circle sample result cream since,0
DermaKtive Aktive AM,More Anti-Aging,1.0,product makeup delivery unscrupulous unopened trial,0
DermaNew Active Hydrator,More Moisturizer,10.0,treatment really prone products product perfect,0
DermaQuest Essential B5 Hydrating Serum,More Moisturizer,7.0,smooth overall moisturizer makeup hydrate blend,0
Dermacia Breathable Cleanser,More Cleanser,8.5,would totally perfect everyday cleanser years,0
Dermacia Breathable Face Moisturizer,More Moisturizer,10.0,product wrinkle remover publice products perfect,0
Dermacia Breathable Tinted Moisturizer,More Moisturizer,9.0,smooth product moisturizers light leave,0
Dermadoctor Kakadu C Brightening Daily Cleanser,More Cleanser,6.0,think cleanser clean citrus smell slight,0
Dermadoctor Kakadu C Face Crème,More Moisturizer,6.0,color suppose moisturize moderately little factor,0
Dermagenics Collagen Recovery Cream,More Moisturizer,10.0,cream triple texture spring recently receive,0
Dermalogica AGE Smart  Power Rich,More Anti-Aging,10.0,small power great youthful years wonderful,0
Dermalogica AGE Smart Antioxidant Hydramist,More Moisturizer,6.5,spray radical fight anything wash buy twitter,0
Dermalogica AGE Smart Dynamic Skin Recovery SPF30,More Anti-Aging,5.0,smell really whole smart product moisturizer,0
Dermalogica AGE Smart Multivitamin Power Concentrate,More Anti-Aging,9.0,product result notice month treatment travel,0
Dermalogica AGE Smart Multivitamin Power Firm,More Eye Treatments,10.0,great product around little cream smooth,0
Dermalogica AGE Smart Renewal Lip Complex,More Anti-Aging,10.0,complex product night moisturize exfoliate years,0
Dermalogica AGE Smart Super Rich Repair,More Anti-Aging,8.5,winter sunscreen really damage would time cream,0
Dermalogica Active Moist,More Moisturizer,8.0,moisturizer light dermalogica product great winter,0
Dermalogica Age Smart Multivitamin Power Serum,More Anti-Aging,9.0,product great fabulous already addition,0
Dermalogica Anti-Bacterial Skin Wash,More Cleanser,9.0,product leave discontinue clean always adult,0
Dermalogica ChrmoaWhite TRx Tri-Active Cleanse,More Cleanser,5.5,unique ultra surface product prepare perhaps,0
Dermalogica Clean Start Bedtime for Breakouts,More Blemish + Acne Control,4.0,smell really product nothing younger wouldnt,0
Dermalogica Clean Start Brighten Up SPF 15,More Moisturizer,8.0,product without twitter throughout thats slight,0
Dermalogica Clean Start Hit the Spot,More Blemish + Acne Control,7.0,apply treatment though reduce notice morning,0
Dermalogica Clear Start Skin Soothing Hydrating Lotion,More Moisturizer,7.0,moisturizer lightweight greasy write would watery,0
Dermalogica Daily Resurfacer,More Anti-Aging,9.0,night great right product leave hydrate,0
Dermalogica Day Bright SPF 15,More Sun Protection,10.0,sheer product moisturizer makeup great today,0
Dermalogica Dermal Clay Cleanser,More Cleanser,9.0,cleanser clean product really leave clear,0
Dermalogica Essential Cleansing Solution,More Cleanser,8.5,cleanser winter leave without twice thight,0
Dermalogica Intensive Eye Repair,More Eye Treatments,10.0,really cream didnt worth total multi,0
Dermalogica Medicated Clearing Gel,More Blemish + Acne Control,7.5,product really clear breakouts treatment though,0
Dermalogica Multi-Active Toner,"More Toners, Astringents",8.0,toner product great smell products makeup,0
Dermalogica Oil Free Matte Block SPF 20,More Sun Protection,8.0,sunblock usually trouble since makeup light,0
Dermalogica Overnight Retinol Repair,More Anti-Aging,7.0,retinol moisturizer cream buffer whichever together,0
Dermalogica Phyto Replenish Oil,More Moisturizer,8.0,winter refresh quickly moisture lightweight leave,0
Dermalogica Precleanse,More Cleanser,9.0,makeup product cleanser clean great cleanse,0
Dermalogica Sebum Clearing Masque,More Blemish + Acne Control,9.5,dermalogica products masque start really result,0
Dermalogica Sheer Moisture SPF15,More Moisturizer,7.0,moisturizer another women like sunscreen moisturizer soften shine,0
Dermalogica Sheer Tint Redness Relief SPF 15,More Moisturizer,10.0,redness product moisturizer foundation leave green,0
Dermalogica Skin Hydrating Booster,More Moisturizer,7.5,worth price wheras vitamins visibly supple special make,0
Dermalogica Skin Kit - Oily,More Moisturizer,10.0,products dermalogica really besides anything amaze,0
Dermalogica Skin Smoothing Cream,More Moisturizer,9.0,cream heavy weight start smooth product,0
Dermalogica Solar Defence Booster SPF30,More Sun Protection,10.0,sunscreen night would without since redhead,0
Dermalogica Soothing Eye Make-up Remover,More Cleanser,10.0,makeup remove remover soothe product sting,0
Dermalogica Special Cleansing Gel,More Cleanser,10.0,cleanser great product leave clean dermalogica,0
Dermalogica Total Eye Care SPF 15,More Eye Treatments,10.0,product cream circle color amaze puffiness,0
Dermalogica Ultra Calming Cleanser for Face and Eyes,More Cleanser,9.0,rinse product gentle cleanser youll without,0
Dermalogica Ultra Sensitive Face Block SPF25,More Sun Protection,9.5,summer prone product great doesnt break,0
Dermalogica UltraCalming Barrier Repair,More Moisturizer,10.0,product dermalogica sensitive great could smooth,0
Dermalogica UltraCalming Serum Concentrate,More Moisturizer,1.0,trial still really product nothing dermologica,0
Dermalogica acne prone skin kit,More Blemish + Acne Control,3.0,products would worse sensitive think someone,0
Dermalogica anti-bac skin wash,More Cleanser,10.0,pretty great clean though little thing sister,0
Dermalogica mediBac Clearing Clearing Mattifier,More Blemish + Acne Control,9.0,product clear shine mattifier dermalogica control,0
Dermalogica mediBac Clearing Clearing Skin Wash,More Cleanser,9.0,products dermalogica product clear really difference,0
Dermalogica mediBac Clearing Oil Control Lotion,More Blemish + Acne Control,8.0,product lotion control little hasnt theres,0
Dermalogica mediBac Clearing Overnight Clearing Gel,More Blemish + Acne Control,8.0,product clear stuff result products overnight,0
Dermalogica mediBac Clearing Special Clearing Booster,More Blemish + Acne Control,5.0,pimples every blemish texture surface small,0
Dermarose Swiss Rose Stem Cell Anti-Aging Eye Serum,More Anti-Aging,7.5,product notice holiday twice puffy puffiness,0
Dermarose Swiss Rose Stem Cell Anti-Aging Face Cream,More Anti-Aging,10.0,product tacky swiss sensitive redness notice,0
Dermelect Resilient Stem Cell Regenerating Treatment,More Anti-Aging,10.0,really products smooth slight since serum,0
Desert Essence Creamy Oil Cleanser,More Cleanser,8.0,watery smell since scent residue outdoorsy,0
Desert Essence Eco-Harvest Tea Tree Oil,More Blemish + Acne Control,9.5,great smell product things small issue,0
Desert Essence Gentle Nourishing Day Cream SPF 15,More Moisturizer,10.0,moisturizer without thick smooth sensitive really,0
Desert Essence Kinder To Skin Tea Tree Oil,More Blemish + Acne Control,8.0,products would product normally years vitamin,0
Desert Essence Natural Facial Cleansing Pads with Tea Tree Oil,More Cleanser,10.0,clean smell really strong clear cleanser,0
Desert Essence Organic Coconut & Jojoba Oil,More Moisturizer,7.0,would scent product great,0
Desert Essence Organic Tea Tree Oil,More Blemish + Acne Control,10.0,product blemish strong scent natural great,0
Desert Essence Organics Age Reversal Pomegranate Facial Cleansing Gel,More Cleanser,8.5,organic facewash catch would first uplift tingle,0
Desert Essence Thoroughly Clean Face Wash,More Cleanser,10.0,really clean product without leave natural,0
Desert Essence Thoroughly Clean Oil Control Lotion,More Moisturizer,10.0,great areas thoroughly since sensitive review,0
Devonne by Demi Deep Facial Cleanser,More Cleanser,9.0,really clean water steam smell shower,0
Devonne by Demi Hydrating Radiance Mist,"More Toners, Astringents",5.0,smell little lavender sticky sometimes slightly,0
Dial Acne Control Face Wash,More Cleanser,10.0,treatments tight smiley since radiant percent receive,0
Diane Young Coneflower Neckline Firmer,More Moisturizer,10.0,great years visable unfortunately result product,0
Diane Young Coneflower Neckline Serum,More Anti-Aging,5.0,serum extremely excite continue claim appear,0
Diane Young Un Wrinkle,More Anti-Aging,10.0,really product natural yourskin wrinkle would,0
Dickinson's Witch Hazel Pads,"More Toners, Astringents",10.0,clean something refresh natural without usual,0
Dior Capture Totale - Multi-Perfection Concentrated Serum,More Anti-Aging,10.0,serum cream smooth products wrinkle would,0
Dior Capture Totale 21 Night Renewal Treatment,More Anti-Aging,1.0,thats product youre younger worth vials,0
Dior Capture Totale Dream Skin,More Moisturizer,7.0,scent youre think serum sephora sensitive,0
Dior Capture Totale Multi-Perfection Crème,More Anti-Aging,10.0,totale cream capture years within result,0
Dior Capture Totale Multi-Perfection Eye Treatment,More Eye Treatments,9.0,cream capture years serum difference better,0
Dior Capture Totale Night Creme,More Anti-Aging,8.0,cream price night totale specify scent,0
Dior Capture Totale One Essential,More Anti-Aging,10.0,product toxins products youre worth money,0
Dior Cleansing Milk,More Cleanser,8.0,makeup waterless sensitive leave cotton cleanser,0
Dior Cleansing Water,More Cleanser,6.0,makeup cotton product leave clean toner,0
Dior Hydra Life Comfort Creme,More Moisturizer,9.0,quest winter venture thats sephora properties,0
Dior L'Or de Vie - La Creme,More Anti-Aging,10.0,years weeks start really product price,0
Dior L'Or de Vie - La Extrait,More Anti-Aging,7.5,friend creme worth toward tighten tendency,0
Dior L'Or de Vie Le Serum,More Anti-Aging,1.0,complete ultimate claim action without warrant,0
Dior Rinse-off Cleansing Foam,More Cleanser,10.0,cleanser leave clean without totally think,0
Distinction Firmalift Firming Face and Eye Serum,More Anti-Aging,9.0,three think stuff result noticeable month,0
Distinction Hydra Firming Eye Gel,More Eye Treatments,10.0,bottle,0
Distinction Tinted Facial Moisturizer,More Moisturizer,8.0,moisturizer surprise smooth since really healthy,0
Doak Dermatologics Amantle Moisturizing Cream,More Moisturizer,10.0,years worse recommend mantle great year never,0
Doak Dermatologics Formula 405 Enriched Face Cream,More Moisturizer,10.0,years think however discontinue cream anywhere,0
Doctor D. Schwab C.S. Citrusome,More Anti-Aging,10.0,serum night vitamin since schwab reduce,0
Doll Face Mai Tai Firming Eye Gel,More Eye Treatments,8.0,tighten tight stuff slide right refresh,0
Doll Face Shanghai Conditioning Toner,"More Toners, Astringents",10.0,youthful would without value utility utilitarian,0
DoshaCare Vata Cleansing Cream,More Cleanser,9.0,winter weather storm start slightly recently,0
DoshaCare Vata Hydrating Elixir,"More Toners, Astringents",6.0,would sample notice maybe difference didnt,0
DoshaCare Vata Hydrating Moisturizer,More Moisturizer,9.0,winter weather storm start slightly recently,0
Dr Bragi Age Management Gel,More Anti-Aging,9.0,swear doesnt totally things sound really,0
Dr. Andrew Weil for Origins Mega-Mushroom Skin Relief Advanced Face Serum,More Anti-Aging,9.5,serum redness product smell origins mushroom,0
Dr. Brandt,More Moisturizer,10.0,product years wonderful wrinkle worth vitamins,0
"Dr. Brandt ""c"" cream",More Moisturizer,8.0,without moisturizer hydrate hours greasy always,0
Dr. Brandt Blemishes No More Intensolution,More Blemish + Acne Control,1.0,think product longer inflame didnt blemish,0
Dr. Brandt Collagen Booster,More Anti-Aging,10.0,stash beauty,0
Dr. Brandt Contour Effect,More Moisturizer,9.5,product younger years weeks think spend,0
Dr. Brandt DNA Transforming Pearl Serum,More Anti-Aging,6.5,moisturizer light wonder thats smooth since,0
Dr. Brandt Flaws No More R3P cream,More Eye Treatments,9.5,cream sample result product night little,0
Dr. Brandt Flaws No More r3p eye,More Eye Treatments,10.0,cream circle product around husband wrinkle,0
Dr. Brandt Flexitone BB Cream,More Moisturizer,8.0,color yellow undertones product pretty first,0
Dr. Brandt House Calls Crease Release,More Anti-Aging,10.0,really product wrinkle products worth release,0
Dr. Brandt Infinite Moisture,More Moisturizer,10.0,little everything describe costly,0
Dr. Brandt Laser Lightning Day Lotion,More Moisturizer,9.0,would texture smoother recommend pretty pigmentation,0
Dr. Brandt Laser Lightning Foaming Cleanser,More Cleanser,9.0,sensitive products great could werent travel,0
Dr. Brandt Laser Lightning Night Cream,More Moisturizer,7.0,would treatments result overall office lighten,0
Dr. Brandt Laser Lightning Toner,"More Toners, Astringents",8.5,though use result recommend prone price overall,0
Dr. Brandt Lineless Anti-glycation Serum,More Anti-Aging,9.0,sugar products sticky smoother smooth since,0
Dr. Brandt Lineless Foaming Cleanser,More Cleanser,9.5,great leave cleaners would without value cleanser,0
Dr. Brandt Lineless Gel Cleanser,More Cleanser,10.0,product smooth write would wasnt throughout,0
Dr. Brandt Lineless Infinite Moisture,More Moisturizer,8.0,wrinkle product repurchase price justify definately,0
Dr. Brandt Lineless Tone,"More Toners, Astringents",5.0,would toner regenerist prefer market,0
Dr. Brandt Pore Effect,More Moisturizer,10.0,product cream smaller really night morning,0
Dr. Brandt Poreless Gel,More Moisturizer,9.0,since product clear poreless moisturizer work gel,0
Dr. Brandt Poreless Moisture,More Moisturizer,7.0,product poreless morning moisturizer effect weeks,0
Dr. Brandt Poreless Tone,"More Toners, Astringents",7.0,though product poreless pore guess minimize great,0
Dr. Brandt Pores No More Anti-Aging Mattifying Lotion,More Anti-Aging,8.0,still result really product noticeable makeup,0
Dr. Brandt UV SPF 30 High Protection Face,More Sun Protection,9.0,product sunscreen makeup never everyday doesnt,0
Dr. Brandt V-zone Neck Cream,More Anti-Aging,5.0,cream doesnt years touch tighten price,0
Dr. Denese Damage Reversal Treatment Pads with Spot Fading Complex,More Anti-Aging,1.0,result stick sadly brown wrinkle whether,0
Dr. Denese Neck Saver Serum,More Anti-Aging,9.5,product young love years couple along,0
Dr. Denese Pore Refining Toner,"More Toners, Astringents",10.0,smell product totally toner stuff still,0
Dr. Denese Skin Recovery Serum,More Moisturizer,10.0,wrinkle wonderful sparkle shine older moisterizer,0
Dr. Denese Skin So Tight Instant Anti-Wrinkle Gel,More Anti-Aging,8.0,wrinkle tighter think purchase product moisturizer,0
Dr. Denese Triple Strength Eye Wrinkle Smoother,More Eye Treatments,1.0,product suppose sticky several remove purchase love,0
Dr. Denese Triple Strength Wrinkle Smoother,More Anti-Aging,8.5,products product serum result purchase peptides,0
Dr. Dennis Gross Skincare All-In-One Cleansing Foam,More Cleanser,9.0,cleanser really product though recommend breakouts,0
Dr. Dennis Gross Skincare All-In-One Facial Cleanser with Toner,More Cleanser,9.5,cleanser makeup clean remove thoroughly thats,0
Dr. Dennis Gross Skincare All-In-One Tinted Moisturizer Sunscreen SPF 15,More Moisturizer,8.5,moisturizer foundation product light coverage provide,0
Dr. Dennis Gross Skincare All-Over Blemish Solution,More Blemish + Acne Control,9.0,product really clear would treatment recommend,0
Dr. Dennis Gross Skincare Antioxidant Firming Face Serum,More Anti-Aging,3.0,nothing would upset think target result,0
Dr. Dennis Gross Skincare Correct & Perfect Spot Treatment,More Blemish + Acne Control,8.0,treatment redness worth doesnt breakout wouldnt,0
Dr. Dennis Gross Skincare Dark Spot Sun Defense Broad Spectrum SPF 50,More Sun Protection,6.0,white subtly streak scent property moisturize,0
Dr. Dennis Gross Skincare EZ4U 4-In-1 Facial Treatment: Normal/Oily,"More Toners, Astringents",8.0,makeup remove first without water two look,0
